{
  "schema_version": "optimization.job/0.1",
  "request_key": "surrogate-tutorial-branin-v1",
  "worker": "fcmaes",
  "payload_schema": "fcmaes.surrogate/1",
  "resources": {"cpu_slots": 8, "outer_workers": 1, "inner_threads": 8},
  "limits": {"wall_time_seconds": 120.0, "grace_seconds": 1.0},
  "inputs": [],
  "payload": {
    "problem": {"id": "benchmark.branin", "version": "1", "config": {"dimension": 2},
      "bounds": {"lower": [-5.0, 0.0], "upper": [10.0, 15.0], "broadcast": false}},
    "seed": 19, "evaluations": 48, "runs": 1, "concurrent": 4,
    "evaluation_threads": 1, "parameters": {}, "recheck_best": true
  }
}
