{
  "schema_version": "optimization.job/0.1",
  "request_key": "tutorial.fcmaes.binh-korn-mode.v1",
  "worker": "fcmaes",
  "payload_schema": "fcmaes.mode/1",
  "resources": {
    "cpu_slots": 8,
    "outer_workers": 8,
    "inner_threads": 1
  },
  "limits": {
    "wall_time_seconds": 30.0,
    "grace_seconds": 1.0
  },
  "inputs": [],
  "payload": {
    "problem": {
      "id": "benchmark.binh-korn",
      "version": "1",
      "config": {
        "dimension": 2
      },
      "bounds": {
        "lower": [
          0.0,
          0.0
        ],
        "upper": [
          5.0,
          3.0
        ],
        "broadcast": false
      }
    },
    "optimizer": {
      "kind": "mode",
      "parameters": {
        "population": 64
      }
    },
    "seed": 42,
    "runs": 8,
    "generations": 100,
    "reference_point": [
      140.0,
      50.0
    ]
  }
}
